[ {
  "unit_of_time" : "Hours",
  "approved" : "8.00",
  "end_time" : "N/A",
  "start_time" : "N/A",
  "time_away_date" : "2008-01-02",
  "approval_date" : "2008-11-05",
  "entered_on" : "2008-11-05",
  "type" : "Vacation (Hours)",
  "time_away_absence_table" : "USA Vacation Time Off (Salaried)",
  "request_type" : "Absence Request",
  "worker" : "Jake Lee",
  "supervisory_organization" : "Executive Management Group",
  "time_away_entry" : "01/02/2008 - 8 Hours (Jake Lee)"
}, {
  "unit_of_time" : "Hours",
  "approved" : "8.00",
  "end_time" : "N/A",
  "start_time" : "N/A",
  "time_away_date" : "2008-01-02",
  "approval_date" : "2009-06-03",
  "entered_on" : "2009-06-03",
  "type" : "Vacation (Hours)",
  "time_away_absence_table" : "USA Vacation Time Off (Salaried)",
  "request_type" : "Absence Request",
  "worker" : "Steve Morgan",
  "supervisory_organization" : "Global Modern Services",
  "time_away_entry" : "01/02/2008 - 8 Hours (Steve Morgan)"
}, {
  "unit_of_time" : "Hours",
  "approved" : "8.00",
  "end_time" : "N/A",
  "start_time" : "N/A",
  "time_away_date" : "2008-01-03",
  "approval_date" : "2008-11-05",
  "entered_on" : "2008-11-05",
  "type" : "Vacation (Hours)",
  "time_away_absence_table" : "USA Vacation Time Off (Salaried)",
  "request_type" : "Absence Request",
  "worker" : "Jake Lee",
  "supervisory_organization" : "Executive Management Group",
  "time_away_entry" : "01/03/2008 - 8 Hours (Jake Lee)"
}, {
  "unit_of_time" : "Hours",
  "approved" : "8.00",
  "end_time" : "N/A",
  "start_time" : "N/A",
  "time_away_date" : "2008-01-03",
  "approval_date" : "2009-06-03",
  "entered_on" : "2009-06-03",
  "type" : "Vacation (Hours)",
  "time_away_absence_table" : "USA Vacation Time Off (Salaried)",
  "request_type" : "Absence Request",
  "worker" : "Steve Morgan",
  "supervisory_organization" : "Global Modern Services",
  "time_away_entry" : "01/03/2008 - 8 Hours (Steve Morgan)"
}, {
  "unit_of_time" : "Hours",
  "approved" : "8.00",
  "end_time" : "N/A",
  "start_time" : "N/A",
  "time_away_date" : "2008-01-04",
  "approval_date" : "2008-11-05",
  "entered_on" : "2008-11-05",
  "type" : "Vacation (Hours)",
  "time_away_absence_table" : "USA Vacation Time Off (Salaried)",
  "request_type" : "Absence Request",
  "worker" : "Jake Lee",
  "supervisory_organization" : "Executive Management Group",
  "time_away_entry" : "01/04/2008 - 8 Hours (Jake Lee)"
}, {
  "unit_of_time" : "Hours",
  "approved" : "8.00",
  "end_time" : "N/A",
  "start_time" : "N/A",
  "time_away_date" : "2008-01-04",
  "approval_date" : "2009-06-03",
  "entered_on" : "2009-06-03",
  "type" : "Vacation (Hours)",
  "time_away_absence_table" : "USA Vacation Time Off (Salaried)",
  "request_type" : "Absence Request",
  "worker" : "Steve Morgan",
  "supervisory_organization" : "Global Modern Services",
  "time_away_entry" : "01/04/2008 - 8 Hours (Steve Morgan)"
}, {
  "unit_of_time" : "Hours",
  "approved" : "8.00",
  "end_time" : "N/A",
  "start_time" : "N/A",
  "time_away_date" : "2008-02-04",
  "approval_date" : "2009-06-03",
  "entered_on" : "2009-06-03",
  "type" : "Vacation (Hours)",
  "time_away_absence_table" : "USA Vacation Time Off (Salaried)",
  "request_type" : "Absence Request",
  "worker" : "Steve Morgan",
  "supervisory_organization" : "Global Modern Services",
  "time_away_entry" : "02/04/2008 - 8 Hours (Steve Morgan)"
}, {
  "unit_of_time" : "Hours",
  "approved" : "8.00",
  "end_time" : "N/A",
  "start_time" : "N/A",
  "time_away_date" : "2008-02-05",
  "approval_date" : "2009-06-03",
  "entered_on" : "2009-06-03",
  "type" : "Vacation (Hours)",
  "time_away_absence_table" : "USA Vacation Time Off (Salaried)",
  "request_type" : "Absence Request",
  "worker" : "Steve Morgan",
  "supervisory_organization" : "Global Modern Services",
  "time_away_entry" : "02/05/2008 - 8 Hours (Steve Morgan)"
}, {
  "unit_of_time" : "Hours",
  "approved" : "8.00",
  "end_time" : "N/A",
  "start_time" : "N/A",
  "time_away_date" : "2008-02-06",
  "approval_date" : "2009-06-03",
  "entered_on" : "2009-06-03",
  "type" : "Vacation (Hours)",
  "time_away_absence_table" : "USA Vacation Time Off (Salaried)",
  "request_type" : "Absence Request",
  "worker" : "Steve Morgan",
  "supervisory_organization" : "Global Modern Services",
  "time_away_entry" : "02/06/2008 - 8 Hours (Steve Morgan)"
}, {
  "unit_of_time" : "Hours",
  "approved" : "8.00",
  "end_time" : "N/A",
  "start_time" : "N/A",
  "time_away_date" : "2008-02-07",
  "approval_date" : "2009-06-03",
  "entered_on" : "2009-06-03",
  "type" : "Vacation (Hours)",
  "time_away_absence_table" : "USA Vacation Time Off (Salaried)",
  "request_type" : "Absence Request",
  "worker" : "Steve Morgan",
  "supervisory_organization" : "Global Modern Services",
  "time_away_entry" : "02/07/2008 - 8 Hours (Steve Morgan)"
}, {
  "unit_of_time" : "Hours",
  "approved" : "8.00",
  "end_time" : "N/A",
  "start_time" : "N/A",
  "time_away_date" : "2008-02-08",
  "approval_date" : "2009-06-03",
  "entered_on" : "2009-06-03",
  "type" : "Vacation (Hours)",
  "time_away_absence_table" : "USA Vacation Time Off (Salaried)",
  "request_type" : "Absence Request",
  "worker" : "Steve Morgan",
  "supervisory_organization" : "Global Modern Services",
  "time_away_entry" : "02/08/2008 - 8 Hours (Steve Morgan)"
}, {
  "unit_of_time" : "Hours",
  "approved" : "8.00",
  "end_time" : "N/A",
  "start_time" : "N/A",
  "time_away_date" : "2008-03-17",
  "approval_date" : "2009-06-03",
  "entered_on" : "2009-06-03",
  "type" : "Vacation (Hours)",
  "time_away_absence_table" : "USA Vacation Time Off (Salaried)",
  "request_type" : "Absence Request",
  "worker" : "Steve Morgan",
  "supervisory_organization" : "Global Modern Services",
  "time_away_entry" : "03/17/2008 - 8 Hours (Steve Morgan)"
}, {
  "unit_of_time" : "Hours",
  "approved" : "8.00",
  "end_time" : "N/A",
  "start_time" : "N/A",
  "time_away_date" : "2008-03-31",
  "approval_date" : "2009-06-03",
  "entered_on" : "2009-06-03",
  "type" : "Vacation (Hours)",
  "time_away_absence_table" : "USA Vacation Time Off (Salaried)",
  "request_type" : "Absence Request",
  "worker" : "Steve Morgan",
  "supervisory_organization" : "Global Modern Services",
  "time_away_entry" : "03/31/2008 - 8 Hours (Steve Morgan)"
}, {
  "unit_of_time" : "Hours",
  "approved" : "8.00",
  "end_time" : "N/A",
  "start_time" : "N/A",
  "time_away_date" : "2008-04-18",
  "approval_date" : "2009-06-03",
  "entered_on" : "2009-06-03",
  "type" : "Vacation (Hours)",
  "time_away_absence_table" : "USA Vacation Time Off (Salaried)",
  "request_type" : "Absence Request",
  "worker" : "Steve Morgan",
  "supervisory_organization" : "Global Modern Services",
  "time_away_entry" : "04/18/2008 - 8 Hours (Steve Morgan)"
}, {
  "unit_of_time" : "Hours",
  "approved" : "8.00",
  "end_time" : "N/A",
  "start_time" : "N/A",
  "time_away_date" : "2008-05-02",
  "approval_date" : "2009-06-03",
  "entered_on" : "2009-06-03",
  "type" : "Vacation (Hours)",
  "time_away_absence_table" : "USA Vacation Time Off (Salaried)",
  "request_type" : "Absence Request",
  "worker" : "Steve Morgan",
  "supervisory_organization" : "Global Modern Services",
  "time_away_entry" : "05/02/2008 - 8 Hours (Steve Morgan)"
}, {
  "unit_of_time" : "Hours",
  "approved" : "8.00",
  "end_time" : "N/A",
  "start_time" : "N/A",
  "time_away_date" : "2008-05-19",
  "approval_date" : "2009-06-03",
  "entered_on" : "2009-06-03",
  "type" : "Vacation (Hours)",
  "time_away_absence_table" : "USA Vacation Time Off (Salaried)",
  "request_type" : "Absence Request",
  "worker" : "Steve Morgan",
  "supervisory_organization" : "Global Modern Services",
  "time_away_entry" : "05/19/2008 - 8 Hours (Steve Morgan)"
}, {
  "unit_of_time" : "Hours",
  "approved" : "8.00",
  "end_time" : "N/A",
  "start_time" : "N/A",
  "time_away_date" : "2008-05-20",
  "approval_date" : "2009-06-03",
  "entered_on" : "2009-06-03",
  "type" : "Vacation (Hours)",
  "time_away_absence_table" : "USA Vacation Time Off (Salaried)",
  "request_type" : "Absence Request",
  "worker" : "Steve Morgan",
  "supervisory_organization" : "Global Modern Services",
  "time_away_entry" : "05/20/2008 - 8 Hours (Steve Morgan)"
}, {
  "unit_of_time" : "Hours",
  "approved" : "8.00",
  "end_time" : "N/A",
  "start_time" : "N/A",
  "time_away_date" : "2008-05-21",
  "approval_date" : "2009-06-03",
  "entered_on" : "2009-06-03",
  "type" : "Vacation (Hours)",
  "time_away_absence_table" : "USA Vacation Time Off (Salaried)",
  "request_type" : "Absence Request",
  "worker" : "Steve Morgan",
  "supervisory_organization" : "Global Modern Services",
  "time_away_entry" : "05/21/2008 - 8 Hours (Steve Morgan)"
}, {
  "unit_of_time" : "Hours",
  "approved" : "8.00",
  "end_time" : "N/A",
  "start_time" : "N/A",
  "time_away_date" : "2008-05-22",
  "approval_date" : "2009-06-03",
  "entered_on" : "2009-06-03",
  "type" : "Vacation (Hours)",
  "time_away_absence_table" : "USA Vacation Time Off (Salaried)",
  "request_type" : "Absence Request",
  "worker" : "Steve Morgan",
  "supervisory_organization" : "Global Modern Services",
  "time_away_entry" : "05/22/2008 - 8 Hours (Steve Morgan)"
}, {
  "unit_of_time" : "Hours",
  "approved" : "8.00",
  "end_time" : "N/A",
  "start_time" : "N/A",
  "time_away_date" : "2008-05-23",
  "approval_date" : "2009-06-03",
  "entered_on" : "2009-06-03",
  "type" : "Vacation (Hours)",
  "time_away_absence_table" : "USA Vacation Time Off (Salaried)",
  "request_type" : "Absence Request",
  "worker" : "Steve Morgan",
  "supervisory_organization" : "Global Modern Services",
  "time_away_entry" : "05/23/2008 - 8 Hours (Steve Morgan)"
}, {
  "unit_of_time" : "Hours",
  "approved" : "8.00",
  "end_time" : "N/A",
  "start_time" : "N/A",
  "time_away_date" : "2008-06-30",
  "approval_date" : "2008-11-05",
  "entered_on" : "2008-11-05",
  "type" : "Vacation (Hours)",
  "time_away_absence_table" : "USA Vacation Time Off (Salaried)",
  "request_type" : "Absence Request",
  "worker" : "Jake Lee",
  "supervisory_organization" : "Executive Management Group",
  "time_away_entry" : "06/30/2008 - 8 Hours (Jake Lee)"
}, {
  "unit_of_time" : "Hours",
  "approved" : "8.00",
  "end_time" : "N/A",
  "start_time" : "N/A",
  "time_away_date" : "2008-07-01",
  "approval_date" : "2008-11-05",
  "entered_on" : "2008-11-05",
  "type" : "Vacation (Hours)",
  "time_away_absence_table" : "USA Vacation Time Off (Salaried)",
  "request_type" : "Absence Request",
  "worker" : "Jake Lee",
  "supervisory_organization" : "Executive Management Group",
  "time_away_entry" : "07/01/2008 - 8 Hours (Jake Lee)"
}, {
  "unit_of_time" : "Hours",
  "approved" : "8.00",
  "end_time" : "N/A",
  "start_time" : "N/A",
  "time_away_date" : "2008-07-02",
  "approval_date" : "2008-11-05",
  "entered_on" : "2008-11-05",
  "type" : "Vacation (Hours)",
  "time_away_absence_table" : "USA Vacation Time Off (Salaried)",
  "request_type" : "Absence Request",
  "worker" : "Jake Lee",
  "supervisory_organization" : "Executive Management Group",
  "time_away_entry" : "07/02/2008 - 8 Hours (Jake Lee)"
}, {
  "unit_of_time" : "Hours",
  "approved" : "8.00",
  "end_time" : "N/A",
  "start_time" : "N/A",
  "time_away_date" : "2008-07-03",
  "approval_date" : "2008-11-05",
  "entered_on" : "2008-11-05",
  "type" : "Vacation (Hours)",
  "time_away_absence_table" : "USA Vacation Time Off (Salaried)",
  "request_type" : "Absence Request",
  "worker" : "Jake Lee",
  "supervisory_organization" : "Executive Management Group",
  "time_away_entry" : "07/03/2008 - 8 Hours (Jake Lee)"
}, {
  "unit_of_time" : "Hours",
  "approved" : "8.00",
  "end_time" : "N/A",
  "start_time" : "N/A",
  "time_away_date" : "2008-07-03",
  "approval_date" : "2009-06-03",
  "entered_on" : "2009-06-03",
  "type" : "Vacation (Hours)",
  "time_away_absence_table" : "USA Vacation Time Off (Salaried)",
  "request_type" : "Absence Request",
  "worker" : "Steve Morgan",
  "supervisory_organization" : "Global Modern Services",
  "time_away_entry" : "07/03/2008 - 8 Hours (Steve Morgan)"
}, {
  "unit_of_time" : "Hours",
  "approved" : "8.00",
  "end_time" : "N/A",
  "start_time" : "N/A",
  "time_away_date" : "2008-08-25",
  "approval_date" : "2009-06-03",
  "entered_on" : "2009-06-03",
  "type" : "Vacation (Hours)",
  "time_away_absence_table" : "USA Vacation Time Off (Salaried)",
  "request_type" : "Absence Request",
  "worker" : "Jake Lee",
  "supervisory_organization" : "Executive Management Group",
  "time_away_entry" : "08/25/2008 - 8 Hours (Jake Lee)"
}, {
  "unit_of_time" : "Hours",
  "approved" : "8.00",
  "end_time" : "N/A",
  "start_time" : "N/A",
  "time_away_date" : "2008-08-25",
  "approval_date" : "2009-06-03",
  "entered_on" : "2009-06-03",
  "type" : "Vacation (Hours)",
  "time_away_absence_table" : "USA Vacation Time Off (Salaried)",
  "request_type" : "Absence Request",
  "worker" : "Steve Morgan",
  "supervisory_organization" : "Global Modern Services",
  "time_away_entry" : "08/25/2008 - 8 Hours (Steve Morgan)"
}, {
  "unit_of_time" : "Hours",
  "approved" : "8.00",
  "end_time" : "N/A",
  "start_time" : "N/A",
  "time_away_date" : "2008-08-26",
  "approval_date" : "2009-06-03",
  "entered_on" : "2009-06-03",
  "type" : "Vacation (Hours)",
  "time_away_absence_table" : "USA Vacation Time Off (Salaried)",
  "request_type" : "Absence Request",
  "worker" : "Jake Lee",
  "supervisory_organization" : "Executive Management Group",
  "time_away_entry" : "08/26/2008 - 8 Hours (Jake Lee)"
}, {
  "unit_of_time" : "Hours",
  "approved" : "8.00",
  "end_time" : "N/A",
  "start_time" : "N/A",
  "time_away_date" : "2008-08-27",
  "approval_date" : "2009-06-03",
  "entered_on" : "2009-06-03",
  "type" : "Vacation (Hours)",
  "time_away_absence_table" : "USA Vacation Time Off (Salaried)",
  "request_type" : "Absence Request",
  "worker" : "Jake Lee",
  "supervisory_organization" : "Executive Management Group",
  "time_away_entry" : "08/27/2008 - 8 Hours (Jake Lee)"
}, {
  "unit_of_time" : "Hours",
  "approved" : "8.00",
  "end_time" : "N/A",
  "start_time" : "N/A",
  "time_away_date" : "2008-08-28",
  "approval_date" : "2009-06-03",
  "entered_on" : "2009-06-03",
  "type" : "Vacation (Hours)",
  "time_away_absence_table" : "USA Vacation Time Off (Salaried)",
  "request_type" : "Absence Request",
  "worker" : "Jake Lee",
  "supervisory_organization" : "Executive Management Group",
  "time_away_entry" : "08/28/2008 - 8 Hours (Jake Lee)"
}, {
  "unit_of_time" : "Hours",
  "approved" : "8.00",
  "end_time" : "N/A",
  "start_time" : "N/A",
  "time_away_date" : "2008-08-29",
  "approval_date" : "2009-06-03",
  "entered_on" : "2009-06-03",
  "type" : "Vacation (Hours)",
  "time_away_absence_table" : "USA Vacation Time Off (Salaried)",
  "request_type" : "Absence Request",
  "worker" : "Jake Lee",
  "supervisory_organization" : "Executive Management Group",
  "time_away_entry" : "08/29/2008 - 8 Hours (Jake Lee)"
}, {
  "unit_of_time" : "Hours",
  "approved" : "8.00",
  "end_time" : "N/A",
  "start_time" : "N/A",
  "time_away_date" : "2008-09-15",
  "approval_date" : "2009-06-03",
  "entered_on" : "2009-06-03",
  "type" : "Vacation (Hours)",
  "time_away_absence_table" : "USA Vacation Time Off (Salaried)",
  "request_type" : "Absence Request",
  "worker" : "Steve Morgan",
  "supervisory_organization" : "Global Modern Services",
  "time_away_entry" : "09/15/2008 - 8 Hours (Steve Morgan)"
}, {
  "unit_of_time" : "Hours",
  "approved" : "8.00",
  "end_time" : "N/A",
  "start_time" : "N/A",
  "time_away_date" : "2008-09-16",
  "approval_date" : "2009-06-03",
  "entered_on" : "2009-06-03",
  "type" : "Vacation (Hours)",
  "time_away_absence_table" : "USA Vacation Time Off (Salaried)",
  "request_type" : "Absence Request",
  "worker" : "Steve Morgan",
  "supervisory_organization" : "Global Modern Services",
  "time_away_entry" : "09/16/2008 - 8 Hours (Steve Morgan)"
}, {
  "unit_of_time" : "Hours",
  "approved" : "8.00",
  "end_time" : "N/A",
  "start_time" : "N/A",
  "time_away_date" : "2008-09-17",
  "approval_date" : "2009-06-03",
  "entered_on" : "2009-06-03",
  "type" : "Vacation (Hours)",
  "time_away_absence_table" : "USA Vacation Time Off (Salaried)",
  "request_type" : "Absence Request",
  "worker" : "Steve Morgan",
  "supervisory_organization" : "Global Modern Services",
  "time_away_entry" : "09/17/2008 - 8 Hours (Steve Morgan)"
}, {
  "unit_of_time" : "Hours",
  "approved" : "8.00",
  "end_time" : "N/A",
  "start_time" : "N/A",
  "time_away_date" : "2008-09-18",
  "approval_date" : "2009-06-03",
  "entered_on" : "2009-06-03",
  "type" : "Vacation (Hours)",
  "time_away_absence_table" : "USA Vacation Time Off (Salaried)",
  "request_type" : "Absence Request",
  "worker" : "Steve Morgan",
  "supervisory_organization" : "Global Modern Services",
  "time_away_entry" : "09/18/2008 - 8 Hours (Steve Morgan)"
}, {
  "unit_of_time" : "Hours",
  "approved" : "8.00",
  "end_time" : "N/A",
  "start_time" : "N/A",
  "time_away_date" : "2008-09-19",
  "approval_date" : "2009-06-03",
  "entered_on" : "2009-06-03",
  "type" : "Vacation (Hours)",
  "time_away_absence_table" : "USA Vacation Time Off (Salaried)",
  "request_type" : "Absence Request",
  "worker" : "Steve Morgan",
  "supervisory_organization" : "Global Modern Services",
  "time_away_entry" : "09/19/2008 - 8 Hours (Steve Morgan)"
}, {
  "unit_of_time" : "Hours",
  "approved" : "8.00",
  "end_time" : "N/A",
  "start_time" : "N/A",
  "time_away_date" : "2008-10-20",
  "approval_date" : "2009-06-03",
  "entered_on" : "2009-06-03",
  "type" : "Sick (Hours)",
  "time_away_absence_table" : "USA Sick Time Off (Salaried)",
  "request_type" : "Absence Request",
  "worker" : "Jake Lee",
  "supervisory_organization" : "Executive Management Group",
  "time_away_entry" : "10/20/2008 - 8 Hours (Jake Lee)"
}, {
  "unit_of_time" : "Hours",
  "approved" : "8.00",
  "end_time" : "N/A",
  "start_time" : "N/A",
  "time_away_date" : "2008-10-31",
  "approval_date" : "2009-06-03",
  "entered_on" : "2009-06-03",
  "type" : "Floating Holiday (Hours)",
  "time_away_absence_table" : "Floating Holiday Time Off",
  "request_type" : "Absence Request",
  "worker" : "Steve Morgan",
  "supervisory_organization" : "Global Modern Services",
  "time_away_entry" : "10/31/2008 - 8 Hours (Steve Morgan)"
}, {
  "unit_of_time" : "Hours",
  "approved" : "8.00",
  "end_time" : "N/A",
  "start_time" : "N/A",
  "time_away_date" : "2008-11-26",
  "approval_date" : "2009-06-03",
  "entered_on" : "2009-06-03",
  "type" : "Floating Holiday (Hours)",
  "time_away_absence_table" : "Floating Holiday Time Off",
  "request_type" : "Absence Request",
  "worker" : "Steve Morgan",
  "supervisory_organization" : "Global Modern Services",
  "time_away_entry" : "11/26/2008 - 8 Hours (Steve Morgan)"
}, {
  "unit_of_time" : "Hours",
  "approved" : "8.00",
  "end_time" : "N/A",
  "start_time" : "N/A",
  "time_away_date" : "2008-11-28",
  "approval_date" : "2009-06-03",
  "entered_on" : "2009-06-03",
  "type" : "Vacation (Hours)",
  "time_away_absence_table" : "USA Vacation Time Off (Salaried)",
  "request_type" : "Absence Request",
  "worker" : "Jake Lee",
  "supervisory_organization" : "Executive Management Group",
  "time_away_entry" : "11/28/2008 - 8 Hours (Jake Lee)"
}, {
  "unit_of_time" : "Hours",
  "approved" : "8.00",
  "end_time" : "N/A",
  "start_time" : "N/A",
  "time_away_date" : "2008-12-22",
  "approval_date" : "2009-06-03",
  "entered_on" : "2009-06-03",
  "type" : "Vacation (Hours)",
  "time_away_absence_table" : "USA Vacation Time Off (Salaried)",
  "request_type" : "Absence Request",
  "worker" : "Steve Morgan",
  "supervisory_organization" : "Global Modern Services",
  "time_away_entry" : "12/22/2008 - 8 Hours (Steve Morgan)"
}, {
  "unit_of_time" : "Hours",
  "approved" : "8.00",
  "end_time" : "N/A",
  "start_time" : "N/A",
  "time_away_date" : "2008-12-23",
  "approval_date" : "2009-06-03",
  "entered_on" : "2009-06-03",
  "type" : "Vacation (Hours)",
  "time_away_absence_table" : "USA Vacation Time Off (Salaried)",
  "request_type" : "Absence Request",
  "worker" : "Steve Morgan",
  "supervisory_organization" : "Global Modern Services",
  "time_away_entry" : "12/23/2008 - 8 Hours (Steve Morgan)"
}, {
  "unit_of_time" : "Hours",
  "approved" : "8.00",
  "end_time" : "N/A",
  "start_time" : "N/A",
  "time_away_date" : "2008-12-24",
  "approval_date" : "2009-06-03",
  "entered_on" : "2009-06-03",
  "type" : "Vacation (Hours)",
  "time_away_absence_table" : "USA Vacation Time Off (Salaried)",
  "request_type" : "Absence Request",
  "worker" : "Steve Morgan",
  "supervisory_organization" : "Global Modern Services",
  "time_away_entry" : "12/24/2008 - 8 Hours (Steve Morgan)"
}, {
  "unit_of_time" : "Hours",
  "approved" : "8.00",
  "end_time" : "N/A",
  "start_time" : "N/A",
  "time_away_date" : "2008-12-29",
  "approval_date" : "2009-06-03",
  "entered_on" : "2009-06-03",
  "type" : "Vacation (Hours)",
  "time_away_absence_table" : "USA Vacation Time Off (Salaried)",
  "request_type" : "Absence Request",
  "worker" : "Jake Lee",
  "supervisory_organization" : "Executive Management Group",
  "time_away_entry" : "12/29/2008 - 8 Hours (Jake Lee)"
}, {
  "unit_of_time" : "Hours",
  "approved" : "8.00",
  "end_time" : "N/A",
  "start_time" : "N/A",
  "time_away_date" : "2008-12-30",
  "approval_date" : "2009-06-03",
  "entered_on" : "2009-06-03",
  "type" : "Vacation (Hours)",
  "time_away_absence_table" : "USA Vacation Time Off (Salaried)",
  "request_type" : "Absence Request",
  "worker" : "Jake Lee",
  "supervisory_organization" : "Executive Management Group",
  "time_away_entry" : "12/30/2008 - 8 Hours (Jake Lee)"
}, {
  "unit_of_time" : "Hours",
  "approved" : "8.00",
  "end_time" : "N/A",
  "start_time" : "N/A",
  "time_away_date" : "2008-12-31",
  "approval_date" : "2009-06-03",
  "entered_on" : "2009-06-03",
  "type" : "Vacation (Hours)",
  "time_away_absence_table" : "USA Vacation Time Off (Salaried)",
  "request_type" : "Absence Request",
  "worker" : "Jake Lee",
  "supervisory_organization" : "Executive Management Group",
  "time_away_entry" : "12/31/2008 - 8 Hours (Jake Lee)"
}, {
  "unit_of_time" : "Hours",
  "approved" : "8.00",
  "end_time" : "N/A",
  "start_time" : "N/A",
  "time_away_date" : "2009-01-02",
  "approval_date" : "2009-06-03",
  "entered_on" : "2009-06-03",
  "type" : "Vacation (Hours)",
  "time_away_absence_table" : "USA Vacation Time Off (Salaried)",
  "request_type" : "Absence Request",
  "worker" : "Jake Lee",
  "supervisory_organization" : "Executive Management Group",
  "time_away_entry" : "01/02/2009 - 8 Hours (Jake Lee)"
}, {
  "unit_of_time" : "Hours",
  "approved" : "8.00",
  "end_time" : "N/A",
  "start_time" : "N/A",
  "time_away_date" : "2009-01-02",
  "approval_date" : "2009-06-03",
  "entered_on" : "2009-06-03",
  "type" : "Floating Holiday (Hours)",
  "time_away_absence_table" : "Floating Holiday Time Off",
  "request_type" : "Absence Request",
  "worker" : "Steve Morgan",
  "supervisory_organization" : "Global Modern Services",
  "time_away_entry" : "01/02/2009 - 8 Hours (Steve Morgan)"
}, {
  "unit_of_time" : "Hours",
  "approved" : "8.00",
  "end_time" : "N/A",
  "start_time" : "N/A",
  "time_away_date" : "2009-01-05",
  "approval_date" : "2009-06-03",
  "entered_on" : "2009-06-03",
  "type" : "Floating Holiday (Hours)",
  "time_away_absence_table" : "Floating Holiday Time Off",
  "request_type" : "Absence Request",
  "worker" : "Steve Morgan",
  "supervisory_organization" : "Global Modern Services",
  "time_away_entry" : "01/05/2009 - 8 Hours (Steve Morgan)"
}, {
  "unit_of_time" : "Hours",
  "approved" : "8.00",
  "end_time" : "N/A",
  "start_time" : "N/A",
  "time_away_date" : "2009-01-23",
  "approval_date" : "2009-06-03",
  "entered_on" : "2009-06-03",
  "type" : "Sick (Hours)",
  "time_away_absence_table" : "USA Sick Time Off (Salaried)",
  "request_type" : "Absence Request",
  "worker" : "Steve Morgan",
  "supervisory_organization" : "Global Modern Services",
  "time_away_entry" : "01/23/2009 - 8 Hours (Steve Morgan)"
}, {
  "unit_of_time" : "Hours",
  "approved" : "8.00",
  "end_time" : "N/A",
  "start_time" : "N/A",
  "time_away_date" : "2009-02-13",
  "approval_date" : "2009-06-03",
  "entered_on" : "2009-06-03",
  "type" : "Vacation (Hours)",
  "time_away_absence_table" : "USA Vacation Time Off (Salaried)",
  "request_type" : "Absence Request",
  "worker" : "Jake Lee",
  "supervisory_organization" : "Executive Management Group",
  "time_away_entry" : "02/13/2009 - 8 Hours (Jake Lee)"
}, {
  "unit_of_time" : "Hours",
  "approved" : "8.00",
  "end_time" : "N/A",
  "start_time" : "N/A",
  "time_away_date" : "2009-02-13",
  "approval_date" : "2009-06-03",
  "entered_on" : "2009-06-03",
  "type" : "Vacation (Hours)",
  "time_away_absence_table" : "USA Vacation Time Off (Salaried)",
  "request_type" : "Absence Request",
  "worker" : "Steve Morgan",
  "supervisory_organization" : "Global Modern Services",
  "time_away_entry" : "02/13/2009 - 8 Hours (Steve Morgan)"
}, {
  "unit_of_time" : "Hours",
  "approved" : "8.00",
  "end_time" : "N/A",
  "start_time" : "N/A",
  "time_away_date" : "2009-02-16",
  "approval_date" : "2009-06-03",
  "entered_on" : "2009-06-03",
  "type" : "Vacation (Hours)",
  "time_away_absence_table" : "USA Vacation Time Off (Salaried)",
  "request_type" : "Absence Request",
  "worker" : "Steve Morgan",
  "supervisory_organization" : "Global Modern Services",
  "time_away_entry" : "02/16/2009 - 8 Hours (Steve Morgan)"
}, {
  "unit_of_time" : "Hours",
  "approved" : "8.00",
  "end_time" : "N/A",
  "start_time" : "N/A",
  "time_away_date" : "2009-03-09",
  "approval_date" : "2009-06-03",
  "entered_on" : "2009-06-03",
  "type" : "Vacation (Hours)",
  "time_away_absence_table" : "USA Vacation Time Off (Salaried)",
  "request_type" : "Absence Request",
  "worker" : "Jake Lee",
  "supervisory_organization" : "Executive Management Group",
  "time_away_entry" : "03/09/2009 - 8 Hours (Jake Lee)"
}, {
  "unit_of_time" : "Hours",
  "approved" : "8.00",
  "end_time" : "N/A",
  "start_time" : "N/A",
  "time_away_date" : "2009-03-10",
  "approval_date" : "2009-06-03",
  "entered_on" : "2009-06-03",
  "type" : "Vacation (Hours)",
  "time_away_absence_table" : "USA Vacation Time Off (Salaried)",
  "request_type" : "Absence Request",
  "worker" : "Jake Lee",
  "supervisory_organization" : "Executive Management Group",
  "time_away_entry" : "03/10/2009 - 8 Hours (Jake Lee)"
}, {
  "unit_of_time" : "Hours",
  "approved" : "8.00",
  "end_time" : "N/A",
  "start_time" : "N/A",
  "time_away_date" : "2009-03-11",
  "approval_date" : "2009-06-03",
  "entered_on" : "2009-06-03",
  "type" : "Vacation (Hours)",
  "time_away_absence_table" : "USA Vacation Time Off (Salaried)",
  "request_type" : "Absence Request",
  "worker" : "Jake Lee",
  "supervisory_organization" : "Executive Management Group",
  "time_away_entry" : "03/11/2009 - 8 Hours (Jake Lee)"
}, {
  "unit_of_time" : "Hours",
  "approved" : "8.00",
  "end_time" : "N/A",
  "start_time" : "N/A",
  "time_away_date" : "2009-03-12",
  "approval_date" : "2009-06-03",
  "entered_on" : "2009-06-03",
  "type" : "Vacation (Hours)",
  "time_away_absence_table" : "USA Vacation Time Off (Salaried)",
  "request_type" : "Absence Request",
  "worker" : "Jake Lee",
  "supervisory_organization" : "Executive Management Group",
  "time_away_entry" : "03/12/2009 - 8 Hours (Jake Lee)"
}, {
  "unit_of_time" : "Hours",
  "approved" : "8.00",
  "end_time" : "N/A",
  "start_time" : "N/A",
  "time_away_date" : "2009-03-13",
  "approval_date" : "2009-06-03",
  "entered_on" : "2009-06-03",
  "type" : "Vacation (Hours)",
  "time_away_absence_table" : "USA Vacation Time Off (Salaried)",
  "request_type" : "Absence Request",
  "worker" : "Jake Lee",
  "supervisory_organization" : "Executive Management Group",
  "time_away_entry" : "03/13/2009 - 8 Hours (Jake Lee)"
}, {
  "unit_of_time" : "Hours",
  "approved" : "8.00",
  "end_time" : "N/A",
  "start_time" : "N/A",
  "time_away_date" : "2009-03-30",
  "approval_date" : "2009-06-03",
  "entered_on" : "2009-06-03",
  "type" : "Vacation (Hours)",
  "time_away_absence_table" : "USA Vacation Time Off (Salaried)",
  "request_type" : "Absence Request",
  "worker" : "Steve Morgan",
  "supervisory_organization" : "Global Modern Services",
  "time_away_entry" : "03/30/2009 - 8 Hours (Steve Morgan)"
}, {
  "unit_of_time" : "Hours",
  "approved" : "8.00",
  "end_time" : "N/A",
  "start_time" : "N/A",
  "time_away_date" : "2009-04-03",
  "approval_date" : "2009-06-03",
  "entered_on" : "2009-06-03",
  "type" : "Vacation (Hours)",
  "time_away_absence_table" : "USA Vacation Time Off (Salaried)",
  "request_type" : "Absence Request",
  "worker" : "Steve Morgan",
  "supervisory_organization" : "Global Modern Services",
  "time_away_entry" : "04/03/2009 - 8 Hours (Steve Morgan)"
}, {
  "unit_of_time" : "Hours",
  "approved" : "8.00",
  "end_time" : "N/A",
  "start_time" : "N/A",
  "time_away_date" : "2009-04-10",
  "approval_date" : "2009-06-03",
  "entered_on" : "2009-06-03",
  "type" : "Floating Holiday (Hours)",
  "time_away_absence_table" : "Floating Holiday Time Off",
  "request_type" : "Absence Request",
  "worker" : "Jake Lee",
  "supervisory_organization" : "Executive Management Group",
  "time_away_entry" : "04/10/2009 - 8 Hours (Jake Lee)"
}, {
  "unit_of_time" : "Hours",
  "approved" : "8.00",
  "end_time" : "N/A",
  "start_time" : "N/A",
  "time_away_date" : "2009-04-10",
  "approval_date" : "2009-06-03",
  "entered_on" : "2009-06-03",
  "type" : "Vacation (Hours)",
  "time_away_absence_table" : "USA Vacation Time Off (Salaried)",
  "request_type" : "Absence Request",
  "worker" : "Steve Morgan",
  "supervisory_organization" : "Global Modern Services",
  "time_away_entry" : "04/10/2009 - 8 Hours (Steve Morgan)"
}, {
  "unit_of_time" : "Hours",
  "approved" : "8.00",
  "end_time" : "N/A",
  "start_time" : "N/A",
  "time_away_date" : "2009-04-13",
  "approval_date" : "2009-06-03",
  "entered_on" : "2009-06-03",
  "type" : "Floating Holiday (Hours)",
  "time_away_absence_table" : "Floating Holiday Time Off",
  "request_type" : "Absence Request",
  "worker" : "Jake Lee",
  "supervisory_organization" : "Executive Management Group",
  "time_away_entry" : "04/13/2009 - 8 Hours (Jake Lee)"
}, {
  "unit_of_time" : "Hours",
  "approved" : "8.00",
  "end_time" : "N/A",
  "start_time" : "N/A",
  "time_away_date" : "2009-05-18",
  "approval_date" : "2009-06-03",
  "entered_on" : "2009-06-03",
  "type" : "Vacation (Hours)",
  "time_away_absence_table" : "USA Vacation Time Off (Salaried)",
  "request_type" : "Absence Request",
  "worker" : "Steve Morgan",
  "supervisory_organization" : "Global Modern Services",
  "time_away_entry" : "05/18/2009 - 8 Hours (Steve Morgan)"
}, {
  "unit_of_time" : "Hours",
  "approved" : "8.00",
  "end_time" : "N/A",
  "start_time" : "N/A",
  "time_away_date" : "2009-05-18",
  "approval_date" : "2011-03-01",
  "entered_on" : "2011-03-01",
  "type" : "Vacation (Hours)",
  "time_away_absence_table" : "USA Vacation Time Off (Salaried)",
  "request_type" : "Absence Request",
  "worker" : "Jake Lee",
  "supervisory_organization" : "Executive Management Group",
  "time_away_entry" : "05/18/2009 - 8 Hours (Jake Lee)"
}, {
  "unit_of_time" : "Hours",
  "approved" : "8.00",
  "end_time" : "N/A",
  "start_time" : "N/A",
  "time_away_date" : "2009-05-19",
  "approval_date" : "2009-06-03",
  "entered_on" : "2009-06-03",
  "type" : "Vacation (Hours)",
  "time_away_absence_table" : "USA Vacation Time Off (Salaried)",
  "request_type" : "Absence Request",
  "worker" : "Steve Morgan",
  "supervisory_organization" : "Global Modern Services",
  "time_away_entry" : "05/19/2009 - 8 Hours (Steve Morgan)"
}, {
  "unit_of_time" : "Hours",
  "approved" : "8.00",
  "end_time" : "N/A",
  "start_time" : "N/A",
  "time_away_date" : "2009-05-19",
  "approval_date" : "2011-03-01",
  "entered_on" : "2011-03-01",
  "type" : "Vacation (Hours)",
  "time_away_absence_table" : "USA Vacation Time Off (Salaried)",
  "request_type" : "Absence Request",
  "worker" : "Jake Lee",
  "supervisory_organization" : "Executive Management Group",
  "time_away_entry" : "05/19/2009 - 8 Hours (Jake Lee)"
}, {
  "unit_of_time" : "Hours",
  "approved" : "8.00",
  "end_time" : "N/A",
  "start_time" : "N/A",
  "time_away_date" : "2009-05-20",
  "approval_date" : "2009-06-03",
  "entered_on" : "2009-06-03",
  "type" : "Vacation (Hours)",
  "time_away_absence_table" : "USA Vacation Time Off (Salaried)",
  "request_type" : "Absence Request",
  "worker" : "Steve Morgan",
  "supervisory_organization" : "Global Modern Services",
  "time_away_entry" : "05/20/2009 - 8 Hours (Steve Morgan)"
}, {
  "unit_of_time" : "Hours",
  "approved" : "8.00",
  "end_time" : "N/A",
  "start_time" : "N/A",
  "time_away_date" : "2009-05-20",
  "approval_date" : "2011-03-01",
  "entered_on" : "2011-03-01",
  "type" : "Vacation (Hours)",
  "time_away_absence_table" : "USA Vacation Time Off (Salaried)",
  "request_type" : "Absence Request",
  "worker" : "Jake Lee",
  "supervisory_organization" : "Executive Management Group",
  "time_away_entry" : "05/20/2009 - 8 Hours (Jake Lee)"
}, {
  "unit_of_time" : "Hours",
  "approved" : "8.00",
  "end_time" : "N/A",
  "start_time" : "N/A",
  "time_away_date" : "2009-05-21",
  "approval_date" : "2009-06-03",
  "entered_on" : "2009-06-03",
  "type" : "Vacation (Hours)",
  "time_away_absence_table" : "USA Vacation Time Off (Salaried)",
  "request_type" : "Absence Request",
  "worker" : "Steve Morgan",
  "supervisory_organization" : "Global Modern Services",
  "time_away_entry" : "05/21/2009 - 8 Hours (Steve Morgan)"
}, {
  "unit_of_time" : "Hours",
  "approved" : "8.00",
  "end_time" : "N/A",
  "start_time" : "N/A",
  "time_away_date" : "2009-05-21",
  "approval_date" : "2011-03-01",
  "entered_on" : "2011-03-01",
  "type" : "Vacation (Hours)",
  "time_away_absence_table" : "USA Vacation Time Off (Salaried)",
  "request_type" : "Absence Request",
  "worker" : "Jake Lee",
  "supervisory_organization" : "Executive Management Group",
  "time_away_entry" : "05/21/2009 - 8 Hours (Jake Lee)"
}, {
  "unit_of_time" : "Hours",
  "approved" : "8.00",
  "end_time" : "N/A",
  "start_time" : "N/A",
  "time_away_date" : "2009-05-22",
  "approval_date" : "2009-06-03",
  "entered_on" : "2009-06-03",
  "type" : "Vacation (Hours)",
  "time_away_absence_table" : "USA Vacation Time Off (Salaried)",
  "request_type" : "Absence Request",
  "worker" : "Steve Morgan",
  "supervisory_organization" : "Global Modern Services",
  "time_away_entry" : "05/22/2009 - 8 Hours (Steve Morgan)"
}, {
  "unit_of_time" : "Hours",
  "approved" : "8.00",
  "end_time" : "N/A",
  "start_time" : "N/A",
  "time_away_date" : "2009-05-22",
  "approval_date" : "2011-03-01",
  "entered_on" : "2011-03-01",
  "type" : "Vacation (Hours)",
  "time_away_absence_table" : "USA Vacation Time Off (Salaried)",
  "request_type" : "Absence Request",
  "worker" : "Jake Lee",
  "supervisory_organization" : "Executive Management Group",
  "time_away_entry" : "05/22/2009 - 8 Hours (Jake Lee)"
}, {
  "unit_of_time" : "Hours",
  "approved" : "8.00",
  "end_time" : "N/A",
  "start_time" : "N/A",
  "time_away_date" : "2009-05-26",
  "approval_date" : "2011-03-01",
  "entered_on" : "2011-03-01",
  "type" : "Sick (Hours)",
  "time_away_absence_table" : "USA Sick Time Off (Salaried)",
  "request_type" : "Absence Request",
  "worker" : "Jake Lee",
  "supervisory_organization" : "Executive Management Group",
  "time_away_entry" : "05/26/2009 - 8 Hours (Jake Lee)"
}, {
  "unit_of_time" : "Hours",
  "approved" : "8.00",
  "end_time" : "N/A",
  "start_time" : "N/A",
  "time_away_date" : "2009-06-12",
  "approval_date" : "2009-06-03",
  "entered_on" : "2009-06-03",
  "type" : "Vacation (Hours)",
  "time_away_absence_table" : "USA Vacation Time Off (Salaried)",
  "request_type" : "Absence Request",
  "worker" : "Steve Morgan",
  "supervisory_organization" : "Global Modern Services",
  "time_away_entry" : "06/12/2009 - 8 Hours (Steve Morgan)"
}, {
  "unit_of_time" : "Hours",
  "approved" : "8.00",
  "end_time" : "N/A",
  "start_time" : "N/A",
  "time_away_date" : "2009-07-29",
  "approval_date" : "2011-03-01",
  "entered_on" : "2011-03-01",
  "type" : "Vacation (Hours)",
  "time_away_absence_table" : "USA Vacation Time Off (Salaried)",
  "request_type" : "Absence Request",
  "worker" : "Jake Lee",
  "supervisory_organization" : "Executive Management Group",
  "time_away_entry" : "07/29/2009 - 8 Hours (Jake Lee)"
}, {
  "unit_of_time" : "Hours",
  "approved" : "8.00",
  "end_time" : "N/A",
  "start_time" : "N/A",
  "time_away_date" : "2009-07-30",
  "approval_date" : "2011-03-01",
  "entered_on" : "2011-03-01",
  "type" : "Vacation (Hours)",
  "time_away_absence_table" : "USA Vacation Time Off (Salaried)",
  "request_type" : "Absence Request",
  "worker" : "Jake Lee",
  "supervisory_organization" : "Executive Management Group",
  "time_away_entry" : "07/30/2009 - 8 Hours (Jake Lee)"
}, {
  "unit_of_time" : "Hours",
  "approved" : "8.00",
  "end_time" : "N/A",
  "start_time" : "N/A",
  "time_away_date" : "2009-07-31",
  "approval_date" : "2011-03-01",
  "entered_on" : "2011-03-01",
  "type" : "Vacation (Hours)",
  "time_away_absence_table" : "USA Vacation Time Off (Salaried)",
  "request_type" : "Absence Request",
  "worker" : "Jake Lee",
  "supervisory_organization" : "Executive Management Group",
  "time_away_entry" : "07/31/2009 - 8 Hours (Jake Lee)"
}, {
  "unit_of_time" : "Hours",
  "approved" : "8.00",
  "end_time" : "N/A",
  "start_time" : "N/A",
  "time_away_date" : "2009-08-03",
  "approval_date" : "2011-03-01",
  "entered_on" : "2011-03-01",
  "type" : "Vacation (Hours)",
  "time_away_absence_table" : "USA Vacation Time Off (Salaried)",
  "request_type" : "Absence Request",
  "worker" : "Jake Lee",
  "supervisory_organization" : "Executive Management Group",
  "time_away_entry" : "08/03/2009 - 8 Hours (Jake Lee)"
}, {
  "unit_of_time" : "Hours",
  "approved" : "8.00",
  "end_time" : "N/A",
  "start_time" : "N/A",
  "time_away_date" : "2009-08-04",
  "approval_date" : "2011-03-01",
  "entered_on" : "2011-03-01",
  "type" : "Vacation (Hours)",
  "time_away_absence_table" : "USA Vacation Time Off (Salaried)",
  "request_type" : "Absence Request",
  "worker" : "Jake Lee",
  "supervisory_organization" : "Executive Management Group",
  "time_away_entry" : "08/04/2009 - 8 Hours (Jake Lee)"
}, {
  "unit_of_time" : "Hours",
  "approved" : "8.00",
  "end_time" : "N/A",
  "start_time" : "N/A",
  "time_away_date" : "2009-08-31",
  "approval_date" : "2011-03-01",
  "entered_on" : "2011-03-01",
  "type" : "Vacation (Hours)",
  "time_away_absence_table" : "USA Vacation Time Off (Salaried)",
  "request_type" : "Absence Request",
  "worker" : "Steve Morgan",
  "supervisory_organization" : "Global Modern Services",
  "time_away_entry" : "08/31/2009 - 8 Hours (Steve Morgan)"
}, {
  "unit_of_time" : "Hours",
  "approved" : "8.00",
  "end_time" : "N/A",
  "start_time" : "N/A",
  "time_away_date" : "2009-09-01",
  "approval_date" : "2011-03-01",
  "entered_on" : "2011-03-01",
  "type" : "Vacation (Hours)",
  "time_away_absence_table" : "USA Vacation Time Off (Salaried)",
  "request_type" : "Absence Request",
  "worker" : "Steve Morgan",
  "supervisory_organization" : "Global Modern Services",
  "time_away_entry" : "09/01/2009 - 8 Hours (Steve Morgan)"
}, {
  "unit_of_time" : "Hours",
  "approved" : "8.00",
  "end_time" : "N/A",
  "start_time" : "N/A",
  "time_away_date" : "2009-09-02",
  "approval_date" : "2011-03-01",
  "entered_on" : "2011-03-01",
  "type" : "Vacation (Hours)",
  "time_away_absence_table" : "USA Vacation Time Off (Salaried)",
  "request_type" : "Absence Request",
  "worker" : "Steve Morgan",
  "supervisory_organization" : "Global Modern Services",
  "time_away_entry" : "09/02/2009 - 8 Hours (Steve Morgan)"
}, {
  "unit_of_time" : "Hours",
  "approved" : "8.00",
  "end_time" : "N/A",
  "start_time" : "N/A",
  "time_away_date" : "2009-09-03",
  "approval_date" : "2011-03-01",
  "entered_on" : "2011-03-01",
  "type" : "Vacation (Hours)",
  "time_away_absence_table" : "USA Vacation Time Off (Salaried)",
  "request_type" : "Absence Request",
  "worker" : "Steve Morgan",
  "supervisory_organization" : "Global Modern Services",
  "time_away_entry" : "09/03/2009 - 8 Hours (Steve Morgan)"
}, {
  "unit_of_time" : "Hours",
  "approved" : "8.00",
  "end_time" : "N/A",
  "start_time" : "N/A",
  "time_away_date" : "2009-09-04",
  "approval_date" : "2011-03-01",
  "entered_on" : "2011-03-01",
  "type" : "Vacation (Hours)",
  "time_away_absence_table" : "USA Vacation Time Off (Salaried)",
  "request_type" : "Absence Request",
  "worker" : "Steve Morgan",
  "supervisory_organization" : "Global Modern Services",
  "time_away_entry" : "09/04/2009 - 8 Hours (Steve Morgan)"
}, {
  "unit_of_time" : "Hours",
  "approved" : "8.00",
  "end_time" : "N/A",
  "start_time" : "N/A",
  "time_away_date" : "2009-09-30",
  "approval_date" : "2011-03-01",
  "entered_on" : "2011-03-01",
  "type" : "Vacation (Hours)",
  "time_away_absence_table" : "USA Vacation Time Off (Salaried)",
  "request_type" : "Absence Request",
  "worker" : "Jake Lee",
  "supervisory_organization" : "Executive Management Group",
  "time_away_entry" : "09/30/2009 - 8 Hours (Jake Lee)"
}, {
  "unit_of_time" : "Hours",
  "approved" : "8.00",
  "end_time" : "N/A",
  "start_time" : "N/A",
  "time_away_date" : "2009-10-01",
  "approval_date" : "2011-03-01",
  "entered_on" : "2011-03-01",
  "type" : "Vacation (Hours)",
  "time_away_absence_table" : "USA Vacation Time Off (Salaried)",
  "request_type" : "Absence Request",
  "worker" : "Jake Lee",
  "supervisory_organization" : "Executive Management Group",
  "time_away_entry" : "10/01/2009 - 8 Hours (Jake Lee)"
}, {
  "unit_of_time" : "Hours",
  "approved" : "8.00",
  "end_time" : "N/A",
  "start_time" : "N/A",
  "time_away_date" : "2009-10-02",
  "approval_date" : "2011-03-01",
  "entered_on" : "2011-03-01",
  "type" : "Vacation (Hours)",
  "time_away_absence_table" : "USA Vacation Time Off (Salaried)",
  "request_type" : "Absence Request",
  "worker" : "Jake Lee",
  "supervisory_organization" : "Executive Management Group",
  "time_away_entry" : "10/02/2009 - 8 Hours (Jake Lee)"
}, {
  "unit_of_time" : "Hours",
  "approved" : "8.00",
  "end_time" : "N/A",
  "start_time" : "N/A",
  "time_away_date" : "2009-10-05",
  "approval_date" : "2011-03-01",
  "entered_on" : "2011-03-01",
  "type" : "Vacation (Hours)",
  "time_away_absence_table" : "USA Vacation Time Off (Salaried)",
  "request_type" : "Absence Request",
  "worker" : "Jake Lee",
  "supervisory_organization" : "Executive Management Group",
  "time_away_entry" : "10/05/2009 - 8 Hours (Jake Lee)"
}, {
  "unit_of_time" : "Hours",
  "approved" : "8.00",
  "end_time" : "N/A",
  "start_time" : "N/A",
  "time_away_date" : "2009-10-06",
  "approval_date" : "2011-03-01",
  "entered_on" : "2011-03-01",
  "type" : "Vacation (Hours)",
  "time_away_absence_table" : "USA Vacation Time Off (Salaried)",
  "request_type" : "Absence Request",
  "worker" : "Jake Lee",
  "supervisory_organization" : "Executive Management Group",
  "time_away_entry" : "10/06/2009 - 8 Hours (Jake Lee)"
}, {
  "unit_of_time" : "Hours",
  "approved" : "8.00",
  "end_time" : "N/A",
  "start_time" : "N/A",
  "time_away_date" : "2009-10-12",
  "approval_date" : "2011-03-01",
  "entered_on" : "2011-03-01",
  "type" : "Sick (Hours)",
  "time_away_absence_table" : "USA Sick Time Off (Salaried)",
  "request_type" : "Absence Request",
  "worker" : "Jake Lee",
  "supervisory_organization" : "Executive Management Group",
  "time_away_entry" : "10/12/2009 - 8 Hours (Jake Lee)"
}, {
  "unit_of_time" : "Hours",
  "approved" : "8.00",
  "end_time" : "N/A",
  "start_time" : "N/A",
  "time_away_date" : "2009-11-02",
  "approval_date" : "2011-03-01",
  "entered_on" : "2011-03-01",
  "type" : "Vacation (Hours)",
  "time_away_absence_table" : "USA Vacation Time Off (Salaried)",
  "request_type" : "Absence Request",
  "worker" : "Steve Morgan",
  "supervisory_organization" : "Global Modern Services",
  "time_away_entry" : "11/02/2009 - 8 Hours (Steve Morgan)"
}, {
  "unit_of_time" : "Hours",
  "approved" : "8.00",
  "end_time" : "N/A",
  "start_time" : "N/A",
  "time_away_date" : "2009-11-03",
  "approval_date" : "2011-03-01",
  "entered_on" : "2011-03-01",
  "type" : "Vacation (Hours)",
  "time_away_absence_table" : "USA Vacation Time Off (Salaried)",
  "request_type" : "Absence Request",
  "worker" : "Steve Morgan",
  "supervisory_organization" : "Global Modern Services",
  "time_away_entry" : "11/03/2009 - 8 Hours (Steve Morgan)"
}, {
  "unit_of_time" : "Hours",
  "approved" : "8.00",
  "end_time" : "N/A",
  "start_time" : "N/A",
  "time_away_date" : "2009-11-04",
  "approval_date" : "2011-03-01",
  "entered_on" : "2011-03-01",
  "type" : "Vacation (Hours)",
  "time_away_absence_table" : "USA Vacation Time Off (Salaried)",
  "request_type" : "Absence Request",
  "worker" : "Steve Morgan",
  "supervisory_organization" : "Global Modern Services",
  "time_away_entry" : "11/04/2009 - 8 Hours (Steve Morgan)"
}, {
  "unit_of_time" : "Hours",
  "approved" : "8.00",
  "end_time" : "N/A",
  "start_time" : "N/A",
  "time_away_date" : "2009-11-04",
  "approval_date" : "2011-03-01",
  "entered_on" : "2011-03-01",
  "type" : "Vacation (Hours)",
  "time_away_absence_table" : "USA Vacation Time Off (Salaried)",
  "request_type" : "Absence Request",
  "worker" : "Jake Lee",
  "supervisory_organization" : "Executive Management Group",
  "time_away_entry" : "11/04/2009 - 8 Hours (Jake Lee)"
}, {
  "unit_of_time" : "Hours",
  "approved" : "8.00",
  "end_time" : "N/A",
  "start_time" : "N/A",
  "time_away_date" : "2009-11-05",
  "approval_date" : "2011-03-01",
  "entered_on" : "2011-03-01",
  "type" : "Vacation (Hours)",
  "time_away_absence_table" : "USA Vacation Time Off (Salaried)",
  "request_type" : "Absence Request",
  "worker" : "Steve Morgan",
  "supervisory_organization" : "Global Modern Services",
  "time_away_entry" : "11/05/2009 - 8 Hours (Steve Morgan)"
}, {
  "unit_of_time" : "Hours",
  "approved" : "8.00",
  "end_time" : "N/A",
  "start_time" : "N/A",
  "time_away_date" : "2009-11-05",
  "approval_date" : "2011-03-01",
  "entered_on" : "2011-03-01",
  "type" : "Vacation (Hours)",
  "time_away_absence_table" : "USA Vacation Time Off (Salaried)",
  "request_type" : "Absence Request",
  "worker" : "Jake Lee",
  "supervisory_organization" : "Executive Management Group",
  "time_away_entry" : "11/05/2009 - 8 Hours (Jake Lee)"
}, {
  "unit_of_time" : "Hours",
  "approved" : "8.00",
  "end_time" : "N/A",
  "start_time" : "N/A",
  "time_away_date" : "2009-11-06",
  "approval_date" : "2011-03-01",
  "entered_on" : "2011-03-01",
  "type" : "Vacation (Hours)",
  "time_away_absence_table" : "USA Vacation Time Off (Salaried)",
  "request_type" : "Absence Request",
  "worker" : "Steve Morgan",
  "supervisory_organization" : "Global Modern Services",
  "time_away_entry" : "11/06/2009 - 8 Hours (Steve Morgan)"
}, {
  "unit_of_time" : "Hours",
  "approved" : "8.00",
  "end_time" : "N/A",
  "start_time" : "N/A",
  "time_away_date" : "2009-11-06",
  "approval_date" : "2011-03-01",
  "entered_on" : "2011-03-01",
  "type" : "Vacation (Hours)",
  "time_away_absence_table" : "USA Vacation Time Off (Salaried)",
  "request_type" : "Absence Request",
  "worker" : "Jake Lee",
  "supervisory_organization" : "Executive Management Group",
  "time_away_entry" : "11/06/2009 - 8 Hours (Jake Lee)"
}, {
  "unit_of_time" : "Hours",
  "approved" : "8.00",
  "end_time" : "N/A",
  "start_time" : "N/A",
  "time_away_date" : "2009-11-23",
  "approval_date" : "2011-03-01",
  "entered_on" : "2011-03-01",
  "type" : "Vacation (Hours)",
  "time_away_absence_table" : "USA Vacation Time Off (Salaried)",
  "request_type" : "Absence Request",
  "worker" : "Steve Morgan",
  "supervisory_organization" : "Global Modern Services",
  "time_away_entry" : "11/23/2009 - 8 Hours (Steve Morgan)"
} ]